{
    "$schema": "../schemas/profile.schema.json",
    "github": "jjani05",
    "displayName": "Janice",
    "tagline": "想把點子做成可以互動的網頁",
    "interests": [
        "AI",
        "前端",
        "開放資料"
    ],
    "faction": {
        "os": "linux",
        "browser": "firefox",
        "editor": "vscode"
    }
}