{
  "$schema": "../schemas/profile.schema.json",
  "github": "yukicoder0509",
  "displayName": "<button onclick='alert(\"XSS\")'>XSS</button>",
  "tagline": "用軟體工程解決生活中遇到的實際問題",
  "interests": ["後端", "前端", "軟體工程"],
  "faction": {
    "os": "macos",
    "browser": "firefox",
    "editor": "vscode"
  }
}
